{
  "id": "lightcarbon-lcr015-d-gallery-2026-10-03-02",
  "candidate_id": "lightcarbon-lcr015-d",
  "role": "gallery",
  "sort_order": 3,
  "subject_accuracy": "exact-platform",
  "media_type": "official-product-photo",
  "content_type": "manufacturer-product-view",
  "label": "Frameset view 3",
  "hosting": {
    "mode": "local",
    "local_path": "/assets/images/sourced/official/lightcarbon-lcr015-d-gallery-2026-10-03-02/99e947a51889b57a-detail-w800.avif",
    "variants": [
      {
        "purpose": "card",
        "file": "bdd8952bc3ad20f7-card-w480.avif",
        "width": 480,
        "height": 480,
        "bytes": 6872,
        "sha256": "bdd8952bc3ad20f70544bcaea544c53ca7c37270bbf865d4e1791b57554f5827",
        "format": "image/avif",
        "quality": 60,
        "url": "/assets/images/sourced/official/lightcarbon-lcr015-d-gallery-2026-10-03-02/bdd8952bc3ad20f7-card-w480.avif"
      },
      {
        "purpose": "detail",
        "file": "99e947a51889b57a-detail-w800.avif",
        "width": 800,
        "height": 800,
        "bytes": 13841,
        "sha256": "99e947a51889b57a88bce108452eddc9947a674d09f7c219be00037ce1dbe9eb",
        "format": "image/avif",
        "quality": 60,
        "url": "/assets/images/sourced/official/lightcarbon-lcr015-d-gallery-2026-10-03-02/99e947a51889b57a-detail-w800.avif"
      }
    ]
  },
  "source_id": "lightcarbon-lcr015-d-gallery-complete-2026-10-03",
  "source_media_page_url": "https://www.lightcarbon.com/lightcarbon-new-aero-carbon-road-disc-brake-frame_p14.html",
  "source_media_url": "https://www.lightcarbon.com/uploadfile/202502/10/2cc340b4234ea9237d53447d40e44a10_medium.jpg",
  "source_media_sha256": "90ba8276b8dcac432bb52a807b084d41522e5614c3a529bb02eaf4544db92a6d",
  "rights": {
    "status": "source-attributed-rehost",
    "copyright_holder": "LightCarbon",
    "usage_note": "Bounded source-attributed derivative for exact model identification and comparison. Copyright remains with its owner; no redistribution license is asserted."
  },
  "credit": "Manufacturer image © LightCarbon — Official frameset reference view. The pictured finish and parts do not establish the selected mainland package.",
  "alt": "LightCarbon LCR015-D — Frameset view 3",
  "display_note": "Official frameset reference view. The pictured finish and parts do not establish the selected mainland package.",
  "reviewed_at": "2026-10-03",
  "editorial_quotation": {
    "purpose": "editorial-identification-and-commentary",
    "scope": "one-compressed-product-photo",
    "source_link_required": true,
    "no_license_asserted": true,
    "removal_route": "https://github.com/p0s/china-bike-research/issues"
  },
  "privacy_review": {
    "reviewed_at": "2026-10-03",
    "embedded_metadata": "stripped",
    "faces": "none-visible",
    "vehicle_registration": "none-visible",
    "account_identifiers": "none-visible",
    "location_identifiers": "none-visible"
  },
  "review_evidence": {
    "reviewed_at": "2026-10-03",
    "source_ids": [
      "lightcarbon-lcr015-d-gallery-complete-2026-10-03"
    ],
    "conclusion": "Original pixels inspected against exact product-page context. Technical diagrams, colour designs, options, sample builds and source-caption conflicts are explicitly scoped; no private identifiers are visible."
  }
}
