{
  "id": "lightcarbon-lcg071-pro-gallery-2026-10-03-16",
  "candidate_id": "lightcarbon-lcg071-pro",
  "role": "gallery",
  "sort_order": 19,
  "subject_accuracy": "exact-platform",
  "media_type": "official-product-photo",
  "content_type": "manufacturer-option-reference",
  "label": "High-end CEMA Brand T47 BB (Ceramic Bearings)",
  "hosting": {
    "mode": "local",
    "local_path": "/assets/images/sourced/official/lightcarbon-lcg071-pro-gallery-2026-10-03-16/6e175759eaf00f2b-detail-w1200.avif",
    "variants": [
      {
        "purpose": "card",
        "file": "d895524a327558af-card-w480.avif",
        "width": 480,
        "height": 131,
        "bytes": 5210,
        "sha256": "d895524a327558afd37962bdb4b38244d8c0095ff87ba00bbe5965834f1432b2",
        "format": "image/avif",
        "quality": 60,
        "url": "/assets/images/sourced/official/lightcarbon-lcg071-pro-gallery-2026-10-03-16/d895524a327558af-card-w480.avif"
      },
      {
        "purpose": "detail",
        "file": "6e175759eaf00f2b-detail-w1200.avif",
        "width": 1200,
        "height": 326,
        "bytes": 19993,
        "sha256": "6e175759eaf00f2bc4ee2c31f6d6f2c820a05812aa0621e457116a20a74bfc69",
        "format": "image/avif",
        "quality": 60,
        "url": "/assets/images/sourced/official/lightcarbon-lcg071-pro-gallery-2026-10-03-16/6e175759eaf00f2b-detail-w1200.avif"
      }
    ]
  },
  "source_id": "lightcarbon-lcg071-pro-gallery-complete-2026-10-03",
  "source_media_page_url": "https://www.lightcarbon.com/lightcarbon-new-gravel-frameset-with-integrated-handlebar_p170.html",
  "source_media_url": "https://www.lightcarbon.com/js/htmledit/kindeditor/attached/20251113/20251113161023_26707.jpg",
  "source_media_sha256": "e0f296d9c62d3527397c1c5dd9e28f62764c46c4a478d015920961f428bcc64b",
  "rights": {
    "status": "source-attributed-rehost",
    "copyright_holder": "LightCarbon",
    "usage_note": "Bounded source-attributed derivative for exact model identification and comparison. Copyright remains with its owner; no redistribution license is asserted."
  },
  "credit": "Manufacturer image © LightCarbon — Manufacturer component or option reference linked by this model page. Inclusion, dimensions and compatibility must be confirmed for the quoted package.",
  "alt": "LightCarbon LCG071-PRO — High-end CEMA Brand T47 BB (Ceramic Bearings)",
  "display_note": "Manufacturer component or option reference linked by this model page. Inclusion, dimensions and compatibility must be confirmed for the quoted package.",
  "reviewed_at": "2026-10-03",
  "editorial_quotation": {
    "purpose": "editorial-identification-and-commentary",
    "scope": "one-compressed-product-photo",
    "source_link_required": true,
    "no_license_asserted": true,
    "removal_route": "https://github.com/p0s/china-bike-research/issues"
  },
  "privacy_review": {
    "reviewed_at": "2026-10-03",
    "embedded_metadata": "stripped",
    "faces": "none-visible",
    "vehicle_registration": "none-visible",
    "account_identifiers": "none-visible",
    "location_identifiers": "none-visible"
  },
  "review_evidence": {
    "reviewed_at": "2026-10-03",
    "source_ids": [
      "lightcarbon-lcg071-pro-gallery-complete-2026-10-03"
    ],
    "conclusion": "Original pixels inspected against exact product-page context. Technical diagrams, colour designs, options, sample builds and source-caption conflicts are explicitly scoped; no private identifiers are visible."
  }
}
