{
  "id": "lightcarbon-lctt001-gallery-2026-10-03-02",
  "candidate_id": "lightcarbon-lctt001",
  "role": "gallery",
  "sort_order": 3,
  "subject_accuracy": "exact-platform",
  "media_type": "official-product-photo",
  "content_type": "manufacturer-product-view",
  "label": "Frameset view 3",
  "hosting": {
    "mode": "local",
    "local_path": "/assets/images/sourced/official/lightcarbon-lctt001-gallery-2026-10-03-02/2360a3e9a67d4915-detail-w800.avif",
    "variants": [
      {
        "purpose": "card",
        "file": "9112d65213e37c1e-card-w480.avif",
        "width": 480,
        "height": 480,
        "bytes": 4330,
        "sha256": "9112d65213e37c1e3c5fe1acb4380e605adfeadb503d5f088efa304c1cdd42bd",
        "format": "image/avif",
        "quality": 60,
        "url": "/assets/images/sourced/official/lightcarbon-lctt001-gallery-2026-10-03-02/9112d65213e37c1e-card-w480.avif"
      },
      {
        "purpose": "detail",
        "file": "2360a3e9a67d4915-detail-w800.avif",
        "width": 800,
        "height": 800,
        "bytes": 7746,
        "sha256": "2360a3e9a67d49155757a247123c742f9eeaf8d76cf07f6da5c9ea623881f384",
        "format": "image/avif",
        "quality": 60,
        "url": "/assets/images/sourced/official/lightcarbon-lctt001-gallery-2026-10-03-02/2360a3e9a67d4915-detail-w800.avif"
      }
    ]
  },
  "source_id": "lightcarbon-lctt001-gallery-complete-2026-10-03",
  "source_media_page_url": "https://www.lightcarbon.com/lightcarbon-aerodynamic-time-trial-carbon-frameset_p28.html",
  "source_media_url": "https://www.lightcarbon.com/uploadfile/201804/17/028c6aea820c5aec8fbd6ef2cada998b_medium.jpg",
  "source_media_sha256": "fe7882be9b0199278851f6879c20cff4689db05c3e6f61950288d9816681f2a9",
  "rights": {
    "status": "source-attributed-rehost",
    "copyright_holder": "LightCarbon",
    "usage_note": "Bounded source-attributed derivative for exact model identification and comparison. Copyright remains with its owner; no redistribution license is asserted."
  },
  "credit": "Manufacturer image © LightCarbon — Official frameset reference view. The pictured finish and parts do not establish the selected mainland package.",
  "alt": "LightCarbon LCTT001 — Frameset view 3",
  "display_note": "Official frameset reference view. The pictured finish and parts do not establish the selected mainland package.",
  "reviewed_at": "2026-10-03",
  "editorial_quotation": {
    "purpose": "editorial-identification-and-commentary",
    "scope": "one-compressed-product-photo",
    "source_link_required": true,
    "no_license_asserted": true,
    "removal_route": "https://github.com/p0s/china-bike-research/issues"
  },
  "privacy_review": {
    "reviewed_at": "2026-10-03",
    "embedded_metadata": "stripped",
    "faces": "none-visible",
    "vehicle_registration": "none-visible",
    "account_identifiers": "none-visible",
    "location_identifiers": "none-visible"
  },
  "review_evidence": {
    "reviewed_at": "2026-10-03",
    "source_ids": [
      "lightcarbon-lctt001-gallery-complete-2026-10-03"
    ],
    "conclusion": "Original pixels inspected against exact product-page context. Technical diagrams, colour designs, options, sample builds and source-caption conflicts are explicitly scoped; no private identifiers are visible."
  }
}
