{
  "id": "kung-mach-xhs-frameset-box-gallery",
  "platform_id": "kung-mach",
  "role": "gallery",
  "label": "Frameset box contents",
  "subject_accuracy": "exact-platform",
  "media_type": "community-post-photo",
  "hosting": {
    "mode": "local",
    "local_path": "/assets/images/sourced/xhs/kung-mach-xhs-frameset-box/5afeb2816076fe61-detail-w1080.webp",
    "variants": [
      {
        "purpose": "card",
        "url": "/assets/images/sourced/xhs/kung-mach-xhs-frameset-box/5a67e5efd4a1bb55-card-w480.webp",
        "width": 480,
        "height": 640,
        "bytes": 24104,
        "sha256": "5a67e5efd4a1bb55e1c9403e27454f4a3dedc0261487cae36aa7bc918ab2aecc",
        "format": "image/webp"
      },
      {
        "purpose": "detail",
        "url": "/assets/images/sourced/xhs/kung-mach-xhs-frameset-box/5afeb2816076fe61-detail-w1080.webp",
        "width": 1080,
        "height": 1440,
        "bytes": 79570,
        "sha256": "5afeb2816076fe6122f6869b8f04e255a1ee953a327a93bb71f35e279c096b48",
        "format": "image/webp"
      }
    ]
  },
  "source_id": "public-xhs-kung-mach-vietnam-brand-2026-08-21",
  "rights": {
    "status": "source-attributed-rehost",
    "copyright_holder": "Original XHS post creator",
    "usage_note": "Small source-attributed editorial derivative for model identification or decision-relevant detail; attribution does not assert a redistribution license."
  },
  "credit": "KUNG on XHS; see source",
  "alt": "Opened KUNG MACH frameset box with a blue frame, fork, seatpost, one-piece bar and a small KUNG accessory box",
  "display_note": "Shows a frameset package in an overseas market; confirm included parts with the seller.",
  "source_media_page_url": "https://www.xiaohongshu.com/explore/6a87bf1900000000320306cd",
  "source_media_sha256": "90e5f07a671436a246441090252eaff3c06cce9856394629d2b4a3e048483a6e",
  "editorial_quotation": {
    "purpose": "editorial-identification-and-commentary",
    "scope": "one-compressed-public-post-photo",
    "source_link_required": true,
    "no_license_asserted": true,
    "removal_route": "https://github.com/p0s/china-bike-research/issues"
  },
  "privacy_review": {
    "reviewed_at": "2026-10-24",
    "embedded_metadata": "stripped",
    "faces": "none-visible",
    "vehicle_registration": "none-visible",
    "account_identifiers": "none-visible",
    "location_identifiers": "none-visible"
  },
  "reviewed_at": "2026-10-24"
}
