{
  "id": "seka-exaero-xhs-dealer-rear-triangle-gallery",
  "candidate_id": "seka-exaero-road",
  "role": "gallery",
  "label": "Dealer build, rear triangle and bottle area",
  "subject_accuracy": "exact-platform",
  "media_type": "retailer-product-photo",
  "hosting": {
    "mode": "local",
    "local_path": "/assets/images/sourced/xhs/seka-exaero-xhs-dealer-rear-triangle/20fdf0f1f7ad3730-detail-w1080.avif",
    "variants": [
      {
        "purpose": "card",
        "url": "/assets/images/sourced/xhs/seka-exaero-xhs-dealer-rear-triangle/78d87ca9deda15d2-card-w480.avif",
        "width": 480,
        "height": 720,
        "bytes": 20002,
        "sha256": "78d87ca9deda15d2c68698e7125117128fad2df9cd2f3db2aedb47f4061a1c29",
        "format": "image/avif"
      },
      {
        "purpose": "detail",
        "url": "/assets/images/sourced/xhs/seka-exaero-xhs-dealer-rear-triangle/20fdf0f1f7ad3730-detail-w1080.avif",
        "width": 1080,
        "height": 1620,
        "bytes": 49166,
        "sha256": "20fdf0f1f7ad3730d077164b180f165a779436b654aa76ca85715865a4663a51",
        "format": "image/avif"
      }
    ]
  },
  "source_id": "public-xhs-seka-exaero-dealer-alta-build-2026-08-27",
  "rights": {
    "status": "source-attributed-rehost",
    "copyright_holder": "Original XHS dealer post creator",
    "usage_note": "Small source-attributed editorial derivative for model identification or decision-relevant detail; attribution does not assert a redistribution license."
  },
  "credit": "XHS dealer post; see source",
  "alt": "SEKA ExAero chainstay, seat tube and aero bottle area with the ExAero decal",
  "display_note": "Dealer display build; tire and wheel are not a clearance measurement.",
  "source_media_page_url": "https://www.xiaohongshu.com/explore/6a8431e0000000003300fff5",
  "source_media_sha256": "c5d83727b25eb9cacaac8c6f84b7c989054e2f93f2d68d6b005050ec32af98c9",
  "editorial_quotation": {
    "purpose": "editorial-identification-and-commentary",
    "scope": "one-compressed-public-post-photo",
    "source_link_required": true,
    "no_license_asserted": true,
    "removal_route": "https://github.com/p0s/china-bike-research/issues"
  },
  "privacy_review": {
    "reviewed_at": "2026-10-24",
    "embedded_metadata": "stripped",
    "faces": "none-visible",
    "vehicle_registration": "none-visible",
    "account_identifiers": "none-visible",
    "location_identifiers": "none-visible"
  },
  "reviewed_at": "2026-10-24"
}
