{
  "id": "velobuild-cx-002-2023-official-enrichment-2026-10-03",
  "candidate_id": "velobuild-cx-002-2023",
  "role": "primary",
  "subject_accuracy": "exact-platform",
  "media_type": "official-product-photo",
  "hosting": {
    "mode": "local",
    "local_path": "/assets/images/sourced/official/velobuild-cx-002-2023-official-enrichment-2026-10-03/a3cb18b6cb4d14dd-detail-w1200.avif",
    "variants": [
      {
        "purpose": "card",
        "file": "52f52759095a72e2-card-w480.avif",
        "width": 480,
        "height": 361,
        "bytes": 4809,
        "sha256": "52f52759095a72e25b55e89a06700fd0cbd0247d3aeeb321e98a18283c71c07e",
        "format": "image/avif",
        "quality": 60,
        "url": "/assets/images/sourced/official/velobuild-cx-002-2023-official-enrichment-2026-10-03/52f52759095a72e2-card-w480.avif"
      },
      {
        "purpose": "detail",
        "file": "a3cb18b6cb4d14dd-detail-w1200.avif",
        "width": 1200,
        "height": 901,
        "bytes": 15113,
        "sha256": "a3cb18b6cb4d14dd2bc631dc908510bc6fcf5b33c1b1c4f7b987b014352d6690",
        "format": "image/avif",
        "quality": 60,
        "url": "/assets/images/sourced/official/velobuild-cx-002-2023-official-enrichment-2026-10-03/a3cb18b6cb4d14dd-detail-w1200.avif"
      }
    ]
  },
  "source_id": "velobuild-cx-002-2023-enrichment-2026-10-03",
  "rights": {
    "status": "source-attributed-rehost",
    "copyright_holder": "VeloBuild",
    "usage_note": "Bounded source-attributed derivative for exact product identification and comparison; copyright remains with its owner and no redistribution license is asserted."
  },
  "credit": "Product image © VeloBuild",
  "alt": "VeloBuild velobuild-cx-002-2023 frameset",
  "display_note": "Exact manufacturer frameset gallery; pictured finish and components do not establish the selected mainland package.",
  "reviewed_at": "2026-10-03",
  "source_media_url": "https://ueeshop.ly200-cdn.com/u_file/UPBA/UPBA916/2312/28/products/638282808c.jpg",
  "source_media_sha256": "7a6f16a2dab1eee0d1f37221ab265222cda857a7c17a264da9ea632ea8781e47",
  "editorial_quotation": {
    "purpose": "editorial-identification-and-commentary",
    "scope": "one-compressed-product-photo",
    "source_link_required": true,
    "no_license_asserted": true,
    "removal_route": "https://github.com/p0s/china-bike-research/issues"
  },
  "privacy_review": {
    "reviewed_at": "2026-10-03",
    "embedded_metadata": "stripped",
    "faces": "none-visible",
    "vehicle_registration": "none-visible",
    "account_identifiers": "none-visible",
    "location_identifiers": "none-visible"
  },
  "review_evidence": {
    "reviewed_at": "2026-10-03",
    "source_ids": [
      "velobuild-cx-002-2023-enrichment-2026-10-03"
    ],
    "conclusion": "Original pixels reviewed against the exact product-linked gallery. Model/variant scope and exclusions are stated in display_note; no private identifiers are visible."
  }
}
