{
  "id": "lightcarbon-lcrxs-d-gallery-2026-10-03-02",
  "candidate_id": "lightcarbon-lcrxs-d",
  "role": "gallery",
  "sort_order": 3,
  "subject_accuracy": "exact-platform",
  "media_type": "official-product-photo",
  "content_type": "manufacturer-product-view",
  "label": "Frameset view 3",
  "hosting": {
    "mode": "local",
    "local_path": "/assets/images/sourced/official/lightcarbon-lcrxs-d-gallery-2026-10-03-02/0597957e9273019f-detail-w550.avif",
    "variants": [
      {
        "purpose": "card",
        "file": "d0c808935ce3ff21-card-w480.avif",
        "width": 480,
        "height": 480,
        "bytes": 5882,
        "sha256": "d0c808935ce3ff21ee954a92b1dbcc4188e67f78d89a5321704b7432dddffc44",
        "format": "image/avif",
        "quality": 55,
        "url": "/assets/images/sourced/official/lightcarbon-lcrxs-d-gallery-2026-10-03-02/d0c808935ce3ff21-card-w480.avif"
      },
      {
        "purpose": "detail",
        "file": "0597957e9273019f-detail-w550.avif",
        "width": 550,
        "height": 550,
        "bytes": 7655,
        "sha256": "0597957e9273019fb81882f6bf7c26f2205081c7152de40b8bd7857e6f385d0f",
        "format": "image/avif",
        "quality": 55,
        "url": "/assets/images/sourced/official/lightcarbon-lcrxs-d-gallery-2026-10-03-02/0597957e9273019f-detail-w550.avif"
      }
    ]
  },
  "source_id": "lightcarbon-lcrxs-d-gallery-complete-2026-10-03",
  "source_media_page_url": "https://www.lightcarbon.com/lightcarbon-new-road-disc-brake-frame-with-integrated-carbon-stem_p122.html",
  "source_media_url": "https://www.lightcarbon.com/uploadfile/201907/19/3353fb9760913451dba559b0f9298882_medium.jpg",
  "source_media_sha256": "eb01c18c41a3d35a7bf27ad91a7daeec217ec0400765a397af416ac60732a0ba",
  "rights": {
    "status": "source-attributed-rehost",
    "copyright_holder": "LightCarbon",
    "usage_note": "Bounded source-attributed derivative for exact model identification and comparison. Copyright remains with its owner; no redistribution license is asserted."
  },
  "credit": "Manufacturer image © LightCarbon — Official frameset reference view. The pictured finish and parts do not establish the selected mainland package.",
  "alt": "LightCarbon LCRXS-D — Frameset view 3",
  "display_note": "Official frameset reference view. The pictured finish and parts do not establish the selected mainland package.",
  "reviewed_at": "2026-10-03",
  "editorial_quotation": {
    "purpose": "editorial-identification-and-commentary",
    "scope": "one-compressed-product-photo",
    "source_link_required": true,
    "no_license_asserted": true,
    "removal_route": "https://github.com/p0s/china-bike-research/issues"
  },
  "privacy_review": {
    "reviewed_at": "2026-10-03",
    "embedded_metadata": "stripped",
    "faces": "none-visible",
    "vehicle_registration": "none-visible",
    "account_identifiers": "none-visible",
    "location_identifiers": "none-visible"
  },
  "review_evidence": {
    "reviewed_at": "2026-10-03",
    "source_ids": [
      "lightcarbon-lcrxs-d-gallery-complete-2026-10-03"
    ],
    "conclusion": "Original pixels inspected against exact product-page context. Technical diagrams, colour designs, options, sample builds and source-caption conflicts are explicitly scoped; no private identifiers are visible."
  }
}
