{
  "id": "hi-light-r6-105-al-official-enrichment-2026-10-03",
  "candidate_id": "hi-light-r6-105-al",
  "role": "primary",
  "subject_accuracy": "same-platform",
  "media_type": "official-product-photo",
  "hosting": {
    "mode": "local",
    "local_path": "/assets/images/sourced/official/hi-light-r6-105-al-official-enrichment-2026-10-03/3c108e9a39586096-detail-w1180.avif",
    "variants": [
      {
        "purpose": "card",
        "file": "1b9a1d64dd2c12d2-card-w480.avif",
        "width": 480,
        "height": 321,
        "bytes": 3847,
        "sha256": "1b9a1d64dd2c12d2f8df037ba44e3e690fa4940df9e90688a6902a7d49038f4b",
        "format": "image/avif",
        "quality": 55,
        "url": "/assets/images/sourced/official/hi-light-r6-105-al-official-enrichment-2026-10-03/1b9a1d64dd2c12d2-card-w480.avif"
      },
      {
        "purpose": "detail",
        "file": "3c108e9a39586096-detail-w1180.avif",
        "width": 1180,
        "height": 787,
        "bytes": 13124,
        "sha256": "3c108e9a3958609626e630136607f79f180440a775e652e518a466e46899419c",
        "format": "image/avif",
        "quality": 60,
        "url": "/assets/images/sourced/official/hi-light-r6-105-al-official-enrichment-2026-10-03/3c108e9a39586096-detail-w1180.avif"
      }
    ]
  },
  "source_id": "hi-light-r6-105-al-enrichment-2026-10-03",
  "rights": {
    "status": "source-attributed-rehost",
    "copyright_holder": "Hi-Light Japan",
    "usage_note": "Bounded source-attributed derivative for exact product identification and comparison; copyright remains with its owner and no redistribution license is asserted."
  },
  "credit": "Product image © Hi-Light Japan · Bare frameset reference; complete build not shown",
  "alt": "Hi-Light Japan hi-light-r6-105-al bare frameset reference",
  "display_note": "Exact regional R6 bare-frame reference. The retained China 105 AL complete build, size and finish remain unverified; the shared G7.2 geometry asset is excluded.",
  "reviewed_at": "2026-10-03",
  "source_media_url": "https://storage.googleapis.com/studio-design-asset-files/projects/JpOLjRr8aQ/s-1180x787_v-fs_webp_0b183987-632a-4f82-a28f-f531c1b4a0fe.jpg",
  "source_media_sha256": "87018bb80985ac13057cb99992db9527d773542afec8da799a362e2340984e41",
  "editorial_quotation": {
    "purpose": "editorial-identification-and-commentary",
    "scope": "one-compressed-product-photo",
    "source_link_required": true,
    "no_license_asserted": true,
    "removal_route": "https://github.com/p0s/china-bike-research/issues"
  },
  "privacy_review": {
    "reviewed_at": "2026-10-03",
    "embedded_metadata": "stripped",
    "faces": "none-visible",
    "vehicle_registration": "none-visible",
    "account_identifiers": "none-visible",
    "location_identifiers": "none-visible"
  },
  "review_evidence": {
    "reviewed_at": "2026-10-03",
    "source_ids": [
      "hi-light-r6-105-al-enrichment-2026-10-03"
    ],
    "conclusion": "Original pixels reviewed against the exact product-linked gallery. Model/variant scope and exclusions are stated in display_note; no private identifiers are visible."
  }
}
