{
  "id": "lightcarbon-lcr018-d-gallery-2026-10-03-17",
  "candidate_id": "lightcarbon-lcr018-d",
  "role": "gallery",
  "sort_order": 17,
  "subject_accuracy": "exact-platform",
  "media_type": "official-product-photo",
  "content_type": "model-feature-illustration",
  "label": "Fork with optimized offset to match different sizes",
  "hosting": {
    "mode": "local",
    "local_path": "/assets/images/sourced/official/lightcarbon-lcr018-d-gallery-2026-10-03-17/7f06ecdbb6e2ecbf-detail-w1200.avif",
    "variants": [
      {
        "purpose": "card",
        "file": "6a545346fd043ef0-card-w480.avif",
        "width": 480,
        "height": 202,
        "bytes": 7299,
        "sha256": "6a545346fd043ef02b72e2bcbdf16c2f3391a15039d3e128705c7e0b94332580",
        "format": "image/avif",
        "quality": 60,
        "url": "/assets/images/sourced/official/lightcarbon-lcr018-d-gallery-2026-10-03-17/6a545346fd043ef0-card-w480.avif"
      },
      {
        "purpose": "detail",
        "file": "7f06ecdbb6e2ecbf-detail-w1200.avif",
        "width": 1200,
        "height": 505,
        "bytes": 24111,
        "sha256": "7f06ecdbb6e2ecbfa1b3646d9768f916ede452721ef4a727ca9474e76181b354",
        "format": "image/avif",
        "quality": 60,
        "url": "/assets/images/sourced/official/lightcarbon-lcr018-d-gallery-2026-10-03-17/7f06ecdbb6e2ecbf-detail-w1200.avif"
      }
    ]
  },
  "source_id": "lightcarbon-lcr018-d-gallery-complete-2026-10-03",
  "source_media_page_url": "https://www.lightcarbon.com/lightcarbon-aero-endurance-disc-brake-road-carbon-frameset-with-integrated-handlebar_p268.html",
  "source_media_url": "https://www.lightcarbon.com/js/htmledit/kindeditor/attached/20251218/20251218173148_22807.jpg",
  "source_media_sha256": "9c3e593acd8fa49acebf29603da950d22323439f7e30de993b75c9d95ce627c5",
  "rights": {
    "status": "source-attributed-rehost",
    "copyright_holder": "LightCarbon",
    "usage_note": "Bounded source-attributed derivative for exact model identification and comparison. Copyright remains with its owner; no redistribution license is asserted."
  },
  "credit": "Manufacturer image © LightCarbon — Manufacturer model feature illustration. Source annotations remain attributed claims and do not establish an independent measurement.",
  "alt": "LightCarbon LCR018-D — Fork with optimized offset to match different sizes",
  "display_note": "Manufacturer model feature illustration. Source annotations remain attributed claims and do not establish an independent measurement.",
  "reviewed_at": "2026-10-03",
  "editorial_quotation": {
    "purpose": "editorial-identification-and-commentary",
    "scope": "one-compressed-product-photo",
    "source_link_required": true,
    "no_license_asserted": true,
    "removal_route": "https://github.com/p0s/china-bike-research/issues"
  },
  "privacy_review": {
    "reviewed_at": "2026-10-03",
    "embedded_metadata": "stripped",
    "faces": "none-visible",
    "vehicle_registration": "none-visible",
    "account_identifiers": "none-visible",
    "location_identifiers": "none-visible"
  },
  "review_evidence": {
    "reviewed_at": "2026-10-03",
    "source_ids": [
      "lightcarbon-lcr018-d-gallery-complete-2026-10-03"
    ],
    "conclusion": "Original pixels inspected against exact product-page context. Technical diagrams, colour designs, options, sample builds and source-caption conflicts are explicitly scoped; no private identifiers are visible."
  }
}
