{
  "id": "vook-v8e-xhs-stem-cockpit-gallery",
  "candidate_id": "vook-v8e-pro",
  "role": "gallery",
  "label": "V8E cockpit and stem",
  "subject_accuracy": "same-platform",
  "media_type": "retailer-product-photo",
  "hosting": {
    "mode": "local",
    "local_path": "/assets/images/sourced/xhs/vook-v8e-xhs-stem-cockpit/2d9d78971fa24d44-detail-w1080.webp",
    "variants": [
      {
        "purpose": "card",
        "url": "/assets/images/sourced/xhs/vook-v8e-xhs-stem-cockpit/0583d39590cec8e7-card-w480.webp",
        "width": 480,
        "height": 633,
        "bytes": 15028,
        "sha256": "0583d39590cec8e7ae75dbbc9d4188dad42094c65693454a929dda29791872e2",
        "format": "image/webp"
      },
      {
        "purpose": "detail",
        "url": "/assets/images/sourced/xhs/vook-v8e-xhs-stem-cockpit/2d9d78971fa24d44-detail-w1080.webp",
        "width": 1080,
        "height": 1424,
        "bytes": 42624,
        "sha256": "2d9d78971fa24d44766dd2c448e2aee6c0bbe72634dee19a6d6858144b4cddee",
        "format": "image/webp"
      }
    ]
  },
  "source_id": "public-xhs-vook-v8e-seller-photos-2026-10-24",
  "rights": {
    "status": "source-attributed-rehost",
    "copyright_holder": "Original XHS post creator",
    "usage_note": "Small source-attributed editorial derivative for model identification or decision-relevant detail; attribution does not assert a redistribution license."
  },
  "credit": "XHS seller post; see source",
  "alt": "VOOK V8E carbon handlebar and stem top cap viewed from above",
  "display_note": "Seller-posted V8E photo; Pro-trim identity is not confirmed. Camera information strip removed.",
  "source_media_page_url": "https://www.xiaohongshu.com/explore/69d052ed000000001a02b50c",
  "source_media_sha256": "1c4039c5e5489394c1976e364926cbfd423190af7ea1a8b7a1b34fa7ab772511",
  "editorial_quotation": {
    "purpose": "editorial-identification-and-commentary",
    "scope": "one-compressed-public-post-photo",
    "source_link_required": true,
    "no_license_asserted": true,
    "removal_route": "https://github.com/p0s/china-bike-research/issues"
  },
  "privacy_review": {
    "reviewed_at": "2026-10-24",
    "embedded_metadata": "stripped",
    "faces": "none-visible",
    "vehicle_registration": "none-visible",
    "account_identifiers": "none-visible",
    "location_identifiers": "none-visible"
  },
  "reviewed_at": "2026-10-24"
}
